<?xml version="1.0" encoding="ISO-8859-1" ?>
<!--
 * Copyright 2001-2009 The Apache Software Foundation.
 *
 * Licensed under the Apache License, Version 2.0 (the "License");
 * you may not use this file except in compliance with the License.
 * You may obtain a copy of the License at
 *
 *      http://www.apache.org/licenses/LICENSE-2.0
 *
 * Unless required by applicable law or agreed to in writing, software
 * distributed under the License is distributed on an "AS IS" BASIS,
 * WITHOUT WARRANTIES OR CONDITIONS OF ANY KIND, either express or implied.
 * See the License for the specific language governing permissions and
 * limitations under the License.
 *
 */ -->

<uddi xmlns="urn:juddi-apache-org:v3_client" xsi:schemaLocation="classpath:/xsd/uddi-client.xsd">
    <reloadDelay>5000</reloadDelay>
    <client name="uddi-portlet-client">
		<nodes>
			<node isHomeJUDDI="true">
				<name>default</name>
				<properties>
					<property name="serverName" value="localhost"/>
					<property name="serverPort" value="8080"/>
					<property name="rmiPort" value="1099"/>
					<!-- for UDDI nodes that use HTTP u/p, using the following 
					<property name="basicAuthUsername" value="root" />
					<property name="basicAuthPassword" value="password" />
					<property name="basicAuthPasswordIsEncrypted" value="false" />
					<property name="basicAuthPasswordCryptoProvider" value="org.apache.juddi.v3.client.crypto.AES128Cryptor (an example)" />-->
				</properties>
				<description>Main jUDDI node</description>
				<!-- JAX-WS Transport -->
				<proxyTransport>org.apache.juddi.v3.client.transport.JAXWSTransport</proxyTransport>
				<custodyTransferUrl>http://${serverName}:${serverPort}/juddiv3/services/custody-transfer</custodyTransferUrl>
				<inquiryUrl>http://${serverName}:${serverPort}/juddiv3/services/inquiry</inquiryUrl>
		        <publishUrl>http://${serverName}:${serverPort}/juddiv3/services/publish</publishUrl>
		        <securityUrl>http://${serverName}:${serverPort}/juddiv3/services/security</securityUrl>
				<subscriptionUrl>http://${serverName}:${serverPort}/juddiv3/services/subscription</subscriptionUrl>
				<subscriptionListenerUrl>http://${serverName}:${serverPort}/juddiv3/services/subscription-listener</subscriptionListenerUrl>
				<juddiApiUrl>http://${serverName}:${serverPort}/juddiv3/services/juddi-api</juddiApiUrl>
				<!-- In VM Transport Settings 
				<proxyTransport>org.apache.juddi.v3.client.transport.InVMTransport</proxyTransport>
				<custodyTransferUrl>org.apache.juddi.api.impl.UDDICustodyTransferImpl</custodyTransferUrl>
				<inquiryUrl>org.apache.juddi.api.impl.UDDIInquiryImpl</inquiryUrl>
		        <publishUrl>org.apache.juddi.api.impl.UDDIPublicationImpl</publishUrl>
		        <securityUrl>org.apache.juddi.api.impl.UDDISecurityImpl</securityUrl>
				<subscriptionUrl>org.apache.juddi.api.impl.UDDISubscriptionImpl</subscriptionUrl>
				<subscriptionListenerUrl>org.apache.juddi.api.impl.UDDISubscriptionListenerImpl</subscriptionListenerUrl>
				<juddiApiUrl>org.apache.juddi.api.impl.JUDDIApiImpl</juddiApiUrl>
				-->
				<!-- RMI Transport Settings 
				<proxyTransport>org.apache.juddi.v3.client.transport.RMITransport</proxyTransport>
				<custodyTransferUrl>/juddiv3/UDDICustodyTransferService</custodyTransferUrl>
				<inquiryUrl>/juddiv3/UDDIInquiryService</inquiryUrl>
		        <publishUrl>/juddiv3/UDDIPublicationService</publishUrl>
		        <securityUrl>/juddiv3/UDDISecurityService</securityUrl>
				<subscriptionUrl>/juddiv3/UDDISubscriptionService</subscriptionUrl>
				<subscriptionListenerUrl>/juddiv3/UDDISubscriptionListenerService</subscriptionListenerUrl>
				<juddiApiUrl>/juddiv3/JUDDIApiService</juddiApiUrl>
				<javaNamingFactoryInitial>org.jnp.interfaces.NamingContextFactory</javaNamingFactoryInitial>
				<javaNamingFactoryUrlPkgs>org.jboss.naming</javaNamingFactoryUrlPkgs>
				<javaNamingProviderUrl>jnp://${serverName}:${rmiPort}</javaNamingProviderUrl>
				-->
			</node>
		</nodes>
		<clerks registerOnStartup="false">
		   <clerk name="MarketingCratchit" node="default" publisher="marketing" password="marketing" isPasswordEncrypted="false" cryptoProvider=""/> 
	   </clerks>
	</client> 
   
</uddi>
